Id-Doc,ArabicTitle,EnglishTitle
D126, نمذجة جيولوجية متقدمة وتحليل غير مؤكد في خزان الغاز الكلاسيكي المعقد من   المملكة العربية السعودية ,ADVANCED GEOLOGICAL MODELING AND UNCERTAINTY ANALYSIS IN A COMPLEX CLASTIC GAS ESERVOIR FROM SAUDI ARABIA
D127, مساعدة لتجميع كود الخصائص المتشابهة ,An Aid to Similar Characteristics Code Clustering
D128, داء مكيفات الهواء باستخدام بادئ تشغيل ناعم ,AIR CONDITIONERS PERFORMANCE USING SOFT STARTER
D129," فصل الهواء على المناخل الجزيئية الكربونية ، الزيوليت A  4 و A  5 عن طريق   امتزاز التأرجح بالضغط ","Air Separation on Carbon Molecular Sieves, 4A and 5A Zeolites by Pressure Swing Adsorption"
D130, كل تعديل الانعكاس البصري باستخدام السطحية الرنين البلازموني ,ALL OPTICAL REFLECTIVITY MODULATION UTILIZING SURFACE PLASMON RESONANCE
D131, بولي إلكتروليتات البرمائية: التوصيف والتطبيق في التخثر / التلبيد ,AMPHIPHILIC POLYELECTROLYTES: CHARACTERIZATION AND APPLICATION IN COAGULATION/FLOCCULATION
D132, تحليل وتطبيق التحسين الميداني الطارئ في موجة السهم متعدد الطبقات ,ANALYSIS AND APPLICATION OF EVANESCENT FIELD ENHANCEMENT IN MULTI-LAYER ARROW WAVEGUIDE
D133, تحليل وتصنيف أنظمة السمعة في شبكات النظير إلى النظير ,ANALYSIS AND CLASSIFICATION OF REPUTATION SYSTEMS IN PEER-TO-PEER NETWORKS
D134, تحليل وتصميم الأنابيب المدفونة ,ANALYSIS AND DESIGN OF BURIED PIPELINES
D135, تحليل وتنفيذ RTDS من ستاتكوم لتعزيز استقرار نظام الطاقة ,ANALYSIS AND RTDS IMPLEMENTATION OF STATCOM FOR POWER SYSTEM STABILITY ENHANCEMENT
D136, تحليل إضافة / إسقاط مرشحات الموجة الضوئية بأشكال تجويف مستوية ,ANALYSIS OF ADD/DROP OPTICAL WAVEGUIDE FILTERS WITH PLANAR CAVITY SHAPES
D137, تحليل إضافة / إسقاط مرشحات الموجة الضوئية مع التجاويف الرنانة المضمنة   باستخدام طريقة الخطوط ,ANALYSIS OF ADD/DROP OPTICAL WAVEGUIDE FILTERS WITH EMBEDDED RESONANT CAVITIES USING THE METHOD OF LINES
D138, تحليل تجويف دليل الموجة الضوئية العاكس المضاد باستخدام طريقة الخطوط ,ANALYSIS OF ANTIRESONANT REFLECTING OPTICAL WAVEGUIDE GRATING USING THE METHOD OF LINES
D139, امتزاز ثاني أكسيد الكربون باستخدام الرماد المتطاير المعالج كيميائيا ً ,Adsorption of Carbon Dioxide Using Chemically Treated Fly Ash
D140, التقييم والتنبؤ وتحسين موثوقية قوالب البثق ,"Assessment, Prediction and Enhancement of the Reliability of Extrusion Dies"
D141, تقييم حالة بداية التيار الصاعد من قضبان فرانكلين النشطة ,Assessment of Onset Condition of Upward Streamer from Energized Franklin rods
D142, تقييم ممارسات القدرة الإنشائية بين المقاولين العامين في المنطقة الشرقية بالمملكة   العربية السعودية ,ASSESSMENT OF CONSTRUCT ABILITY PRACTICES AMONG GENERAL CONTRACTORS IN THE EASTERN PROVINCE OF SAUDI ARABIA
D143," تقييم البارامترات الهيدروجيولوجية من دراسة المقطع الرقيق للحجر الرملي   الطباشيري الأوسط ، تكوين الواسيا ، المملكة العربية السعودية ","Assessment of hydrogeological parameters from thin section study of Middle Cretaceous sandstone, Wasia Formation, Saudi Arabia"
D144, تقييم قيمة R الفعالة لبناء المغلف باستخدام تقنية عالية الدقة للتصوير الحراري ,ASSESSMENT OF EFFECTIVE R-VALUE OF BUILDING ENVELOPE USING HIGH DEFINITION THERMAL IMAGING TECHNIQUE
D145, تقييم قوة الخرسانة عن طريق اختبار لور وكابو ,ASSESSMENT OF CONCRETE STRENGTH BY LOR AND CAPO TESTS
D146, تقرير حول تقييم الوضع الراهن للبنية التحتية وسياسات قطاع الإعلام في المملكة   العربية السعودية ,ASSESSMENT OF FACTORS AFFECTING BUILDING MAINTENANCE MANAGEMENT AUDITING IN SAUDI ARABIA
D147, تقييم تصميم وتشغيل أنظمة التدفئة والتهوية وتكييف الهواء من أجل جودة الهواء   الداخلي في المملكة العربية السعودية ,Assessment of HVAC Systems Design and Operation for Indoor Air Quality in Saudi Arabia
D148, تقييم تصورات إدارة المخاطر وممارسات مقاولي البناء في المملكة العربية السعودية ,Assessment of Risk Management Perceptions and Practices of Construction Contractors in Saudi Arabia
D149, تقييم إجراءات السلامة في تصميم المباني السكنية في المملكة العربية السعودية ,ASSESSMENT OF SAFETY MEASURES IN THE DESIGN OF RESIDENTIAL BUILDINGS IN SAUDI ARABIA
D150, تقييم العلاقة بين حجم LNAPL المنسكب وسمكه في مراقبة الآبار مع الأخذ في   الاعتبار تاريخ تقلب جدول المياه ,ASSESSMENT OF THE RELATIONSHIP BETWEEN THE SPILLED LNAPL VOLUME AND ITS THICKNESS IN MONITORING WELLS CONSIDERING THE WATER TABLE FLUCTUATION HISTORY
D151, تقييم المشكلات التي تواجه صناعة الصيانة في المملكة العربية السعودية ,ASSESSMENT OF THE PROBLEMS FACING THE MAINTENANCE INDUSTRY IN SAUDI ARABIA
D152, تقييم عدم اليقين في قياسات المسامية باستخدام الرنين المغناطيسي النووي وأدوات   التسجيل التقليدية في مكامن الكربونات ,Assessment of Uncertainty in Porosity Measurements using NMR and Conventional Logging Tools in Carbonate Reservoirs
D153, إجراء تقييم للجودة البيئية الداخلية المقبولة في مرافق الرعاية الصحية ,AN ASSESSMENT PROCEDURE FOR ACCEPTABLE INDOOR ENVIRONMENTAL QUALITY IN HEALTH CARE FACILITIES
D154, لشبكات العصبية المرتبطة بالذاكرة لتصحيح الأخطاء في رموز الكتل الخطية ,ASSOCIATIVE MEMORY NEURAL NETWORKS FOR ERROR CORRECTION OF LINEAR BLOCK CODES
D155, الحث غير المتماثل في إضافة سيكلو 1.3 -ثنائي القطب باستخدام النيترونات اللولبية ,"Asymmetric Induction In 1,3-Dipolar Cycloaddition Using Chiral Nitrones"
D156, السلوك المقوم لحلول بعض مشكلات المرونة المرئية ّ ِ ,ASYMPTOTIC BEHAVIOUR OF SOLUTIONS OF SOME VISCOELASTIC PROBLEMS
D157, مهاجمة شبكات الاتصال المجهولة من خلال تصحيح المنفذ ,ATTACKING ANONYMOUS COMMUNICATION NETWORKS THROUGH PORT REDIRECTION
D158, المصادقة على تخصيص العناوين غير الرسمية في شبكات 6  IPv ,AUTHENTICATION FOR STATELESS ADDRESS ALLOCATION IN IPv6 NETWORKS
D159, تقييم مستوى السلامة في أداء أعمال صيانة المباني في المملكة العربية السعودية ,ASSESSMENT OF SAFETY LEVEL IN PERFORMING BUILDING MAINTENANCE WORK IN SAUDI ARABIA
D160, تقييم الخصائص الجيوتقنية لخلائط الرمل المارل المستقرة للأغراض الإنشائية ,Assessment o f the geotechnical properties of stabilized sand-marl mixtures for constructional purposes
D161, تقييم الكثافة وقوة القص في الرمال الشرقية السعودية باستخدام اختبار اختراق   المخروط الديناميكي (DCPT) ,ASSESSMENT OF DENSITY AND SHEAR STRENGTH OF EASTERN SAUDI SANDS USING DYNAMIC CONE PENETRATION TESTING (DCPT)
D162, أتمتة إيصال الأنسولين إلى مرضى السكر ,Automated Insulin Delivery to Diabetic Patients
D163, الية vhdl المؤلفة من ahpl ,Automated VHDL Composition from AHPL
D164, التعرف الالي على الصكوك العربية المكتوبة يدويا ,Automatic Arabic Handwritten Check Recognition
D165, التصنيف التلقائي للكلام والموسيقى في الصوت المرقم ,Automatic Classification of Speech & Music in Digitized Audio
D166, الالتقاط الالي للموجات الأولية الارتدادية باستخدام معدلات الطاقة ,Automated capture of reverberated primary waves using energy rates
D167, استخدام المعدات والمواد الموفرة للطاقة ,Use of energy efficient equipment and materials
D168, جهاز فوترة آلي للخدمات العامة ,Automatic billing device for public services
D169, نظام AutoVLSI : نظام تخطيط لتصميمات VLSI العامة للخلية ,AutoVLSI SYSTEM: A Layout System for General-Cell VLSI Designs
D170, التصميم الخلفي لنظام نمطى للتركيب العالي ,BACK-END DESIGN OF A FORMAL HIGH LEVEL SYNTHESIS SYSTEM
D171, قواعد الاتصال الاكفا للطاقة و مدى الترددات للشبكات اللسلكية في وجود قنوات   متلاشية ,Bandwith and Power Efficient Routing protocols for wireless Ad Hoc Networks in the presence of Fading Channel
D172, تحديد القياسات الأولية لكمية المبيدات الحشرية العضوية الكلورية والفسفورية في   الخليج العربي ,Baseline Monitoring of Selected Organochlorine Pesticides (OCPs) and Organophosphorus Pesticides (OPPs) in the Arabian Gulf
D173, التنبؤ البايزي لنموذج الانحدار الخطي المتعدد مع الارتباط التلقائي من الدرجة الأولى ,Bayesian Prediction for the Multiple Linear Regression Model with First Order Autocorrelation
D174, تخمين Bazzoni-Glaz حول البعد العام الضعيف للحلقات الغاوسية ,Bazzoni-Glaz Conjecture on the Weak Global Dimension of Gaussian Rings
D175, سلوك نموذج مجموعة الخوازيق المحملة لاحقا في الرمال ً ,BEHAVIOR OF LATERALLY LOADED PILE GROUP MODEL IN SAND
D176, سلوك الموجات النافذة في أوساط التكبير ,BEHAVIOR OF TRANSMITTED WAVE IN GAIN MEDIA
D177, مقارنة أداء نظم الصيانة في بروكتر و غامبل ,Benchmarking Maintenance Systems in Procter and Gamble
D178, مقاييس وتقييم تقنية البصمة المائية في البرمجيات ,BENCHMARKING FRAMEWORK FOR SOFTWARE WATERMARKING
D179, خوارزمية معادلة أعمى مع إجراء متغير حجم الخطوة ,A Blind Equalization Algorithm With Variable Step-Size Procedure
D180, المعالجة البيولوجية للملوثات الخطرة في تسلسل المفاعلات الدفعية ,BIOLOGICAL TREATMENT OF HAZARDOUS CONTAM INANTS IN SEQUENCING BATCH REACTORS
D181, الخصائص الحيوية كأداة لمعايرة الاتصال الرسمي الجوراسي في الجبيله العربية من   OUTCROP في منطقة الرياض إلى السطح في شرق المملكة العربية السعودية ,BIOFACIES AS A TOOL FOR CALIBRATING THE JURASSIC JUBAILA-ARAB FORMATIONAL CONTACT FROM OUTCROP IN RIYADH AREA TO SUBSURFACE IN EASTERN SAUDI ARABIA
D182, الفصل الثنائي بواسطة عمليات امتزاز الضغط المتراجع ,Duodenal separation by means of compressive stresses
D183, ظاهرة التفرع في امتصاص الغاز المتفاعل غير ثابت الحراره ,BIFURCATION PHENOMENA IN NON-ISOTHERMAL REACTIVE GAS ABSORPTION
D184, السندات والمتانة للقضبان الفولاذية المطلية بالإيبوكسي الملتصقة بالانصهار ,BOND AND DURABILITY OF FUSION-BONDED EPOXY-COATED STEEL BARS
D185, السيطره الحدية للمعادلات التفاضلية الجزئية المكافأه ,Limit control of equivalent partial differential equations
D186, السيطرة الحدية للمعالات التفاضلية الجزئية المكافئة غير الخطية ,Boundary Control of Nonlinear Parabolic PDEs
D187, الخطية المحلية وغير المحلية من أكواد الدرجة الثانية القياسية في الشكل العادي ,local and non-local linearization of scalar second order odes in the normal form
D188, تحليل عنصر الحدود للحزم واللوحات غير المنشورية ,Boundary Element Analysis of Non-Prismatic Beams and Plates
D189, الانقطاع في الحلول الكلاسيكسة لنظام يصف الانتشار الحراري بواسطة الموجة الثانية ,Discontinuation of classical solutions for a system describing the thermal propagation by the second wave
D190, إزالة البرومات من الماء باستخدام الكربون المنشط (AC) والأنابيب النانوية الكربونية   المعدلة متعددة الجدران (MWCNT) ,Bromate Removal From Water Using Activated Carbon (AC) and Modified Multi-walled Carbon Nanotubes (MWCNT)
D191, دراسة إمكانية زيادة قوة التحمل على الاعمدة الحديدية المترابطة ,Studying the possibility of increasing the durability on interconnected iron pillars
D192, نماذج رياضية لحساب تكلفة انشاء مشاريع المدارس الحكومية في المملكة العربية   السعودية ,Mathematical models to calculate the cost of construction of public school projects in the Kingdom of Saudi Arabia
D193, دائرة اختبار ذاتية لاختبار ذاكرة مخططات التوزيع ,Self test circuit to test memory distribution schemas
D194, أساس - C نظام التجميع عالية المستوى ,A C-Based High-Level Synthesis System
D195, الفصل السائب لمخاليط الغازات الثنائية عن طريق ضغط التأرجح بالضغط ,BULK SEPARATION OF BINARY GAS MIXTURES BY PRESSURE SWING ADSORPTION
D196, حساب الانسياب المضطرب و انتقال الحرارة داخل القنوات المتسعة و المنضغطة   دوريا ,Calculations of Turbulent Flow and Heat Transfer in Periodically Converging-Diverging Channels
D197, تأثيرات الطفو على توليد الإدخال بسبب النقل اللاميني المختلط في القنوات العمودية ,BUOYANCY EFFECTS ON ENTROPY GENERATION DUE TO LAMINAR MIXED CONVECTION IN VERTICAL CHANNELS
D198, حسابات تدفق السوائل وانتقال الحرارة في القنوات ,CALCULATIONS OF FLUID FLOW AND HEAT TRANSFER IN EXPANDING DUCTS
D199, المعايرة و التحقق من صحة نموذج المحاكاة المجهري لظروف حركة المرور في   مدينة الخبر بالمملكة العربية السعودية ,CALIBRATION AND VALIDATION OF PARAMICS MICROSCOPIC SIMULATION MODEL FOR LOCAL TRAFFIC CONDITION IN SAUDI ARABIA
D200, معيرة نموذج vissem في حركة المرور في كل من الخبر و الدمام بالمملكة العربية   السعودية ,"CALIBRATION OF VISSIM TO THE TRAFFIC CONDITIONS OF KHOBAR AND DAMMAM, SAUDI ARABIA"
D201, إلغاء الفصوص المحززة في صفائف الهوائي الخطي الممسوحة ضوئيًا باستخدام   الخوارزمية الجينية ,cancellation of grating lobes in scanned linear antenna arrays using genetic algorithm
D202, سعى الوها المقطعة بتاثير اضمحلال ناكاقامي ,capacity of slotted aloha under nakagami fading
D203, دراسة الكربون -13 والنيتروجين -15 والفوسفور -31 بالرنين المغناطيسي النووي   للتخليط وتفاعلات الأكسدة والاختزال لبعض مجمعات الذهب (I) ,"Carbon-13, nitrogen-15, and phosphorus-31 NMR study of the scrambling and the redox reactions of some gold(I) complexes"
D204, تكربن السبانك المكونة أساسا من الحديد عند تعرضها لخليط من غازي الميثان و   الهيدروجين ,carburization behavior of iron based alloys in methane / hydrogen gas mixtures
D205, دراسة حسابية و عملية لتفاعل اول أكسيد الكربون مع الالكاينات في وجود مادة الأمين   و المحفز بوركبات عنصر الباليديوم ,catalytic carbonylation of terminal alkyne with amine: computational and experimental investigations of regioselectivity
D206, التكسير الحفزي للزيت المفرغ : تأثير الإضافات و التأثير الكيناتيكي ,cracking of vgo to produce olefins: effect of additives
D207, الأسباب المؤثرة في فشل المقاولين ,causes of contractors’ failures in saudi arabia
D208, سلسلة البلمرة المحفز الحفاز للميتاكريلات والستايرين ,catalytic chain transfer polymerization of methacrylates and styrene
D209, النمذجة الكنسية للبلاستيك المرن للضرر للخرسانة المسلحة ,canonical elastoplstic - damage modelling of reinforced concrete
D210, النشاط الالكتروحفزي لحفازات الكربون المسامي المعدل في تفاعل اكسدة حمض   الفورميك ,electrocatalytic activity of ce/w modified mesoporous carbon supported pt-pd catalysts for formic acid oxidation
D211, عوامل نقل السلسلة: التوصيف واستخدامها في تفاعلات البلمرة ,chain transfer agents: characterization and their use in polymerization reactions
D212, دراسة حول أسباب حوادث الرحلات العملية للمعلمات في المملكة العربية السعودية ,causes of female teacher work trip accidents in the kingdom of saudi arabia
D213, المعوقات المؤثرة على تطبيق منظومة إدارة المبنى في المباني الإدارية ,challenges affecting the implementation of building management systems in office buildings
D214, تغيير الأوامر في مشاريع البناء في المملكة العربية السعودية ,change orders in construction projects in saudi arabia
D215, تصنيف قنوات البث الميكرويفي في المنطقة الجنوبية من المملكة العربية السعودية ,channel characterization of radio links in the southern region of saudi arabia
D216, تقدير القناة في أنظمة ال OFDM ,channel estimation in OFDM systems
D217, خصائص السائقين الشباب المتسببين في ارتكاب حوادث الطرق في منطقة الدمام   الحضرية ,characteristics of young drivers involved in the road accidents in dammam metropolitan area
D218, تعيين خواص التربة المنتفخة في المنطقة الشرقية من المملكة العربية السعودية ,characterization of expansive soils in the eastern province of saudi arabia
D219, التمثيل القنواتي و تحليل الأداء لقنوات ناكاجامي الموجهة و ذات السعة العالية ,channel modeling and performance analysis of directive wideband nakagami fading channels
D220, تحديد و تنقية مياه من مخلفات الصناعات البتروكيماوية لاجل إعادة الاستعمال ,characterization and treatment of a petrochemical wastewater for reuse
D221, خصائص تدفق الزيوت والمياه والغازات معا في الأنابيب الأفقية ,characterization of gas-oil-water in a horizontal pipeline
D222, دراسة خواص مواد حفازة محتوية على الزيولايت بواسطة تفاعل تكسير الهكسان ,characterization of catalytic materials containing zeolites using w-hexane cracking reaction
D223, توصيف الخرسانة العالية الأداء ,characterization of an ultra-high performance concrete
D224, تقييم و تثبيت التربة الجيرية الموجودة في شرق المملكة العربية السعودية ,characterization and stabilization of eastern saudi marls
D225, وصف مثبطات التآكل العضوية رواية ظروف المتدفقة ,characterization of novel organic corrosion inhibitors under flowing conditions
D226, دراسة البولي اثيلين و مركبات الرماد المتطاير و اثر السطح بالرماد المتطاير على   خصائص المركب ,characterization of polyethylene/fly ash composites and impact of surface modification of fly ash on composite properties
D227," توصيف مكامن صخور الاساس المتكسرة، حوض ملوط، جنوب شرق السودان ","characterization of fractured basement reservoir, melutbasin, southeast sudan"
D228, خصائص تدفق الزيوت والمياه في الأنابيب الأفقية ,Characterization of Oil/Water Flows in Horizontal Pipes
D229, توصيف المناخل الجزيئية عن طريق تكسير n - الهكسان ,characterization of molecular sieves by n-hexane cracking
D230, التأثيرات المعتمد على القوات النووية ,charge dependent effects on nuclear forces
D231, تحديد الخواص الحامضية لمواد الزيولايت و تاثيرها الحفزي في انتاج مادة ميثيل ثالث   بيوتيل الاثير ,characterization of the acidic properties of zeolites and their catalytic behavior in the synthesis of mtbe
D232, توصيف عدم التوافق في وسط وشرق المملكة العربية السعودية ,characterization of the hercynian unconformity in central and eastern saudi arabia
D233, التقاط الالكترونات من الذرات الهيدروجنية بواسطة البوزيترون و الميون الموجب ,electron capture from hydrogenic systems by positrons and positive muons
D234, استقرار كيميائي في منطقة القريا شرق السبخة الشرقية ,chemical stabilization of al qurayyah eastern saudi sabkha soil
D235, دراسة حويصلات وخصائص التنقيط لعضو الحجر الجيري العثمانية العربي (D) حقل   الغوار النفطي ,Lithofacies and diagenetic study of the Uthmaniyah Arab-D Limestone Member (Ghawar oil field)
D236, تصنيف طرق إعادة البناء للبرامج الموجهة نحو الجانب بناء على سمات جودة البرنامج ً ,classification of refactoring methods for aspect oriented programming based on software quality attributes
D237, تصنيف طرق إعادة البناء على أساس سمات جودة البرمجيات ,classification of refactoring methods based on software quality attributes
D238," المطثية العسيرة: تقييم الإصابة ومعرفة تدابير مكافحة العدوى بين العاملين في مجال   الرعاية الصحية في مرفق الرعاية الثالثية بالرياض ، المملكة العربية السعودية ","clostridium difficile: incidence and knowledge assessment of infection control measures among health care workers in a tertiary care facility in riyadh, saudi arabia"
D239, خوارزمية قائمة على التجمع لمشكلة الشجرة المستقيمة ,a clustering-based algorithm for the rectilinear steiner tree problem
D240, مرشحات النطاق الترددي المكمل لمستقبل منخفضة إذا بلوتوث ,cmos bandpass filters for low-if bluetooth receiver
D241, الحصول على الكود في تحسين أنظمة 36 ds-cdma وتنفيذ DSP ,Code acquisition in ds-cdma systems optimization 36 and dsp implementation
D242, تقييم العديد من مثبطات التآكل العضوية عن طريق قياس تدفق نفاذ الهيدروجين ,chronoamperometric evaluation of several organic corrosion inhibitors by the measurement of the hydrogen permeation flux
D243, تقنيات الدوائر CMOS للتطبيقات الطبية الحيوية ,cmos circuit techniques for biomedical applications
D244, انتشار الكلوريد في التنبؤ الملموس لظهور التآكل في الهياكل الخرسانية المسلحة ,chloride diffusion in concrete prediction of the onset of corrosion in reinforced concrete structures
D245, تحسين كيميائي وتطوير الحركية في تحليل حقن التدفق ,chemometric optimization and kinetic developments in flow injection analysis
D246, الجوانب الكيميائية لعدم الاستقرار الحراري في وقود الطائرات النفاثة من الزيوت   الخام السعودية-العربية ,chemical aspects of thermal instability in jet fuels from saudi-arabian crude oils
D247, تحديد حلقة مغلقة للمراقبة التنبؤية النموذجية: دراسة حالة ,closed loop identification for model predictive control: a case study
D248, انتشار شقوق الكلال التاكلي و تاثير مثبط الكروميت في الفولاذ المقاوم للصدا الثنائي   الطور ,corrosion fatigue crack propagation and cjtromate inhibition of duplex stainless steel
