Id-Doc,ArabicTitle,EnglishTitle
D249," التآكل ، والخصائص الهيكلية والميكانيكية الدقيقة من سبائك ملغم المتقدمة مع   الإضافات sc و zr في درجات حرارة مرتفعة ","corrosion, micro structural and mechanical characteristics of advanced al-mg alloys with sc and zr additions at elevated temperatures"
D250, التآكل من سوائل الحفر قاعدة المياه في الآبار العميقة والحارة ,"corrosivity of water-base drilling fluids in deep, hot wells"
D251, تصميم فعال من حيث التكلفة من محول توزيع النوع التقليدي باستخدام تقنيات التحسين ,cost effective design of conventional type distribution transformer using optimization techniques
D252, الحماية من التآكل من الكربون الصلب بواسطة طلاء أكسيد الألومنيوم نانو باستخدام   تقنية البلازما حل الحل ,corrosion protection of carbon steel by aluminum oxide nano coatings using solution plasma spray technique
D253, الاهتزاز الالتوائي الانحناء المتزامن للأعمدة الدورانية باستخدام عنصر محدود ,coupled bending torsional vibration of rotating shafts using finite element
D254," ممارسة تقدير التكاليف للمباني من قبل الشركات في المحافظة الشرقية ، المملكة   العربية السعودية ","cost estimation practice for buildings by firms in the eastern province,saudi arabia"
D255, استراتيجيات الصيانة القائمة على الموثوقية للتبادلات الحرارية المعرضة للقاذورات ,Reliability-based maintenance strategies for heat exchanges subject to fouling
D256, انتشار الكراك في cp vc عند درجات حرارة مختلفة ,crack propagation in cp vc at different temperatures
D257, تعدين البيانات في تحديد خواص كربونات ونفاذية من سجلات الآبار على أساس   أنظمة الاستدلال المنطقي الضبابي من النمط 1 والنوع 2: المنهجية والدراسات المقارنة ,data mining in identifying carbonate lithofacies and permeability from well logs based on type-1 and type-2 fuzzy logic inference systems: methodology and comparative studies
D258, رسم خرائط مدفوعة بالبيانات وتخفيف للانعراجات القريبة من السطح ,data driven mapping and attenuation of near-surface diffractors
D259, الحفر المبرد لرقائق كيفلر المركبة TM ,cryogenic drilling of kevlar composite laminates tm
D260, اختيار المكونات وخطوط الأنابيب باستخدام تطور عشوائي ,component selection and pipelining using stochastic evolution
D261, معايير الامتثال لجودة الخرسانة ,compliance criteria for quality concrete
D262, خطة تفتيش كاملة للمكونات الهامة ,a complete inspection plan for critical components
D263, مقارنة بين المنخربات الحديثة والميوسينية من شرق المملكة العربية السعودية ,comparison of recent and miocene foraminifera from eastern saudi arabia
D264, مقارنة بين الامتصاص الثنائي للبروبان والبيوتانيد على الزيوليت a  5 و 13 x ,comparison of binary sorption of propane and n-butane on 5a and 13x zeolites
D265, مقارنة الإجراءات المقبولة لتحديد الجدول الزمني وتأثير التكلفة ,comparison of accepted procedures for determining schedule and cost impact
D266, دراسة مقارنة للطرق الحسابية لحل معادلات تدفق الخزان ثنائية الأبعاد ,comparative study of computational methods for the solution of the two-dimensional reservoir flow equations
D267, دراسة مقارنة للطرق المختلفة للسيطرة على الاهتزاز في نظم تحمل الدوار ,comparative study of different methods of vibration control of rotor bearing systems
D268, تحليل مقارن للتقنيات الذكية للكشف عن تسيير الانترنت الشاذ c ,a comparative analysis of intelligent techniques for detecting anomalous internet tra c
D269, الاتصال عبر قنوات الخبو مع إزاحة التردد ,communication over fading channels with frequency offsets
D270, تخطيط نظام الطاقة المركبة في بيئة تنافسية ,composite power system planning in a competitive environment
D271, أثر التداخلات الكهرومغناطيسية المتولدة من خطوط نقل الطاقة ذات الجهد العالي على   خطوط الأنابيب والاتصالات المدفونة ,electromagnetic interference caused by a high voltage transmission network on buried pipelines & communication cables
D272, دراسة حسابية للسلوك التشكيلي والتحليلات لأطياف الذبذبات لبعض الكيتونات ,computational study of conformational behavior and analyses of vibrational spectra of some ketenes
D273, دراسة حسابية لحقل التدفق من خلال سلسلة من الجسيمات الهوائية ناكا 0012 ,computational study of the flowfield through a cascade of naca 0012 airfoils
D274, النمذجة الحاسوبية للانكماش في الخرسانة التي تم إصلاحها ,computational modelling of shrinkage in repaired concrete
D275," النمذجة الحسابية للعلاج الكيميائي ، نمذجة تآزر المتانة في الخرسانة ",computational chemo-damage transport modeling of durability synergies in concrete
D276, حساب التفردات في b.v.p.'s باستخدام الفروق المحدودة مع حذف الكتلة ,computation of singularities in b.v.p.’s using finite differences with block-elimination
D277, نهج استشعار مضغوط لتقدير القناة من أجل اتصالات الموجات الراديوية فائقة الاتساع   الراديوية الراديوية النبضية ,a compressed sensing approach to channel estimation for impulse radio ultra wideband ir-uwb communication
D278, حسابات التدرج التركيبية لخزان تكثيف الغاز العربي السعودي ,compositional gradient calculations for a saudi arabian gas condensate reservoir
D279, النمذجة بمساعدة الحاسوب ومحاكاة تدفق الخرسانة ذاتية الانضغاط ,computer-aided modeling and simulation of flow of self compacting concrete
D280, اختبار تكيفي محوسب باستخدام الشبكات العصبية ,computerized adaptive testing using neural networks
D281, نموذج AHP المحوسب لحل مشكلة قرار العطاء / عدم العطاء ,computerized ahp model for solving bid/no-bid decision problem
D282, نظام تقدير مفاهيمية محوسبة لمشروعات إمدادات المياه المحلية ,computerized conceptual-cost-estimating system for domestic water supply projects
D283, استخدام الكمبيوتر من قبل مقاولي البناء في المملكة العربية السعودية ,computer utilization by construction contractors in saudi arabia
D284, نموذج صنع القرار متعدد المعايير المحوسب لتخطيط المشاريع وتنفيذها ,computerized multiple criteria decesion making model for projects planning and implementation
D285, نموذج تعليمات بمساعدة الكمبيوتر للغات البرمجة الإجرائية ,computer aided instruction model for procedural programming languages
D286, نموذج مفاهيمي لاختيار الاستشاري في المملكة العربية السعودية ,a conceptual model for consultant selection in saudi arabia
D287, التزامن في ملفات الشبكة القائمة على الاستيفاء ,concurrency in interpolation based grid files
D288, عملية تسخين بالليزر محدودة التوصيل وغير التوصيل - محاكاة رياضية ,conduction and non-conduction limited laser heating process- mathematical simulation
D289, كتل بناء تناظرية قابلة للتكوين للمصفوفات التناظرية القابلة للبرمجة الميدانية ,configurable analog building blocks for field programmable analog arrays
D290, إدارة الازدحام في شبكة النقل باستخدام ستاتكوم ,congestion management of transmission network using statcom
D291, نقل الحرارة بالحمل القسري المترافق في الحلقات اللامتراكزة ,conjugate forced convection heat transfer in eccentric annuli
D292, إصلاح الخرسانة مع الخرسانة المرشوشة دخان السيليكا ,concrete repair with silica fume shotcrete
D293, تصميم الخلطة الخرسانية للطقس الحار ,concrete mix design for hot weather
D294, نقل الحرارة بالحمل الحر المتقارن في الحلقات الرأسية اللامتراكزة ,conjugate free convection heat transfer in vertical eccentric annuli
D295, نقل الحرارة بالحمل الطبيعي المترافق في الحلقات الرأسية متحدة المركز ,conjugate natural convection heat transfer in vertical concentric annuli
D296, مراقبة تكاليف البناء في المنطقة الشرقية من المملكة العربية السعودية ,construction cost control in the eastern province of saudi arabia
D297, نموذج للتكلفة الكلية لمرافق مياه التحلية الصغيرة بطريقة التناضح العكسي ,a life cycle costing model for small reverse osmosis water treatment facilities
D298, تمويل البناء في المملكة العربية السعودية ,construction financing in saudi arabia
D299, التنبؤ بالتدفق النقدي لأصحاب المشاريع الانشائية ,construction project cash flow prediction for owners
D300, التحكم في الازدحام المدرك للمحتوى على شبكات mpls لنقل الوسائط المتعددة ,content-a ware congestion control over mpls networks for multimedia transmission
D301, تحكم مستمر تقريبي - الوقت الأمثل لآلية مؤازرة من الدرجة الثالثة لها نبات بثلاثة   جذور حقيقية ,continuous proximate time-optimal control for a third order servomechanism having a plant with three real roots
D302, توزيع مخاطر العقود في مشاريع البناء بالمملكة العربية السعودية ,contract risk allocation in saudi arabian construction projects
D303, نموذج متصل للموجات المرنة في مركبات الأنابيب النانوية الكربونية المدمجة ,a continuum model for elastic waves in embedded carbon nanotube composites
D304, التأهيل المسبق للمقاول: نموذج محوسب للمشروعات العامة في البحرين ,contractor prequalification: a computerized model for public projects in bahrain
D305, خوارزميات التحكم للنظم الصناعية الموزعة الشبكية ,control algorithms for distributed networked industrial systems
D306, التحكم وتقدير شبكات الاتصالات غير الموثوق بها ,control and estimation over unreliable communication networks
D307, مضبوط الحجم (23-  MTT (zsm زيوليت للتكسير التحفيزي ,controlled size mtt (zsm-23) zeolites for catalytic cracking
D308, ضوابط محسّنة لتقليل الحمل الحراري ,Optimized controls to minimize the heat load
D309, السيطرة على التآكل في الفولاذ باستخدام ألياف النانو متعدد الطبقات ,control of corrosion in steel using polyelectrolyte multilayer nanofilms
D310, ضبط التاكل في حديد الستانليس ستيل باستعمال البولي الكترولايت ,control of corrosion in stainless steel using polyelectrolytes multilayer
D311, ً تقييم أنظمة جودة المقاولين وفقا لمعيار 9000 ISO ,Contractors quality systems-assessment to the ISO 9000 standard
D312, مخططات الإرسال التعاوني للوصلة الصاعدة لأنظمة mimo اللاسلكية ,cooperative uplink transmission schemes for wireless mimo systems
D313, خصائص نقل الحرارة بالحمل الحراري في الأسرة المعبأة المستطيلة ذات التسخين   غير المتماثل ,convective heat transfer characteristics in the rectangular packed beds with asymmetric heating
D314, استعادة النحاس من مياه الصرف الصحي باستخدام مفاعل أسطواني كهروكيميائي دوار ,copper recovery from wastewater using an electrochemical rotating barrel reactor
D315, تنسيق طريقة البحث لتحسين تدفق الحرارة على قرص إنشائي ,coordinate search method to optimize heat flow on a constructal disc
D316, سلوك التآكل من الفولاذ الطري في ظل الظروف الجوية وتسارع بعد العلاج عن   طريق العديد من الحلول المانع ,corrosion behavior of mild steel under atmospheric and accelerated conditions after treatment by several inhibitor solutions
D317, معايير الحماية الكاثودية للصلب في الخرسانة في سياق بيئة الخليج العربي ,criteria for cathodic protection of steel in concrete in the context of arabian gulf environment
D318, الآثار المترتبة على متغيرات التصميم المعماري ,cost implications of architectural design variables
D319, مرشح عام ومذبذب قائم على الناقل الحالي ,current conveyor-based universal filter and oscillator
D320, تفاعلات الاظافة الحلقية لمركبات سيانوكيتين ,cyanoketene cycloaddition reactions
D321, مخطط الإنتاج الدوري لتحسين أداء الخزان ,cyclic production scheme to improve reservoir performance
D322, تفاعلات الحمل الحلقية للنيترون الحلقية غير المتجانسة ,cycloaddition reactions of a heterocyclic nitrone
D323, البلمرة الحلقية لمركبات البيرزينيوم غير المشبعة ,cyclo polymerization of unsaturated quaternary piperazinium compounds
D324, تعزيز التخميد لنظام الطاقة متعدد الآلات من خلال التحكم في ستاتكوم ,damping enhancement of multimachine power system through statcom control
D325, تصميم مخصص وتنفيذ عقدة مستشعر لاسلكي ونظام Mac الموفر للطاقة   وبروتوكولات التوجيه ,"custom design and implementation of a wireless sensor node, energy-efficient mac and routing protocols"
D326, تقنية اكتساب الرموز باستخدام الفلاتر التكيفية في الاتصالات اللاسلكية ,code acquisition technique using adaptive filters in wireless communication
D327, مولد تعليمات حاسبات الفاكس للغة الضاد ,code generation for dhad on vax
D328, آلة الاتصال المعرفية ذاتية البناء ,the cognitive self-structuring connectionist machine
D329, المعادلات القائمة على التماسك للدراسات الديناميكية طويلة المدى ,coherence based equivalents for long-term dynamic studies
D330, وكيل واجهة مستقلة تعاونية للبحث على شبكة الإنترنت الشخصية ,collaborative autonomous interface agent for personalized web search
D331, التعرف على الوجه بالألوان باستخدام تحليل مكون مبدأ quaternion ,color face recognition using quaternion principle component analysis (q-pca)
D332, التعرف على قزحية الألوان ومطابقتها باستخدام موجات الجابون quaternion ,color iris recognition and matching using quaternion gabor wavelets
D333, العمليات المركبة بين الأكسدة الكهربائية والتخثير الكهربي لمعالجة مياه الصرف   الصحي للبلدية ,combined electrooxidation and electrocoagulation processes for the treatment of municipal wastewater
D334, الجمع بين المصنفات باستخدام نظرية ديمبستر شيفر للأدلة ,combining classifiers using the dempstershafer theory of evidence
D335, الاتصالات الحرة إدارة الشحن من المركبات الكهربائية تحت قيود الشبكة ,communication free charging management of electric vehicles under grid constraints
D336, مقارنة حجم الهيدروكربون بين (تحليل الرمل الرقائقي) والتقنيات القياسية في خزانات   الحجر الرملي ذات المقاومة المنخفضة ,comparing hydrocarbon volume between lsa (laminated sand analysis) and standard techniques in low resistivity sandstone reservoirs
D337, قياس الجهد الكهربائي التفاضلي ككاشف محتمل لتحليل الحقن المتسلسل و HPLC ,differential electrolytic potentiometry as a potential detector for sequential injection analysis and hplc
D338, التحكم اللامركزي على الأنظمة الديناميكية المترابطة ,decentralized control of interconnected dynamical systems
D339, معالج تدفق البيانات لشبكات الانتشار العصبية الخلفية: الهندسة المعمارية وتقييم الأداء ,dataflow processor for back propagation neural networks: Civil Engineering and performance evaluation
D340, عوامل القرار للاستعانة بمصادر خارجية لخدمات الصيانة في الجامعات السعودية ,decision factors for outsourcing the maintenance services of saudi universities
D341, معادلة ردود الفعل على القرار باستخدام هياكل الشبكة العصبية الهجينة ,decision feedback equalization using hybrid lattice-neural network structures
D342, تدهور ميثيل ثلاثي الإيثيل بوتيل باستخدام الأشعة فوق البنفسجية / ثاني أكسيد   التيتانيوم والأنابيب النانوية الكربونية متعددة الجدران ,degradation of methyl tertiary butyl ether using uv/titanium dioxide and multi-walled carbon nanotubes
D343, التأخير في بناء مشاريع المرافق العامة في المملكة العربية السعودية ,delay in the construction of public utility projects in saudi arabia
D344, سلوك درجة حرارة الكثافة من المخاليط الهيدروكربونية الثنائية والمحددة النقية   والمحددة ,density temperature behavior of pure and defined binary and ternary hydrocarbon mixtures
D345, نشر خدمات التشغيل الثلاثي عبر شبكات IP الموجودة ,deploying triple-play services over existing ip networks
D346, تصميم وتحليل شبكة هرمية متسامحة ومتعددة الأطراف ,"design and analysis of a hierarchical, fault-tolerant, multicomputer network"
D347, تصميم وتحليل المعالجات المشفرة ذات المنحنى الإهليلجي الفعال والآمن ,design and analysis of efficient and secure elliptic curve cryptoprocessors
D348, تصميم وتحليل نظام الأرصاد الجوية الآلية لمملكة المملكة العربية السعودية ,design and analysis of the automated meteorological system for the kingdom of saudi arabia
D349, الأصل و البيئات الترسيبية لحجر وجيد الرملي منطقة ابها خميس مشيط جنوب غرب   المملكة العربية السعودية ,"depositional environments and provenance of the wajid sandstone, abha-khamis mushayt area, southwestern saudi arabia"
D350, تصميم وتصنيع طائرتين جالستين مع جناح متقدم دوار متطور ,design & fabrication of two seated aircraft with an advanced rotating leading edge wing
D351, تصميم وتحليل مفتاح التسامح مع الخطأ لـ b-isdn ,design and analysis of a fault tolerant switch for b-isdn
D352," تصميم وبناء محرقة سائلة ، طريقة جديدة للقياسات الكيميائية السريعة ومراقبة التغذية   المرتدة ","design and construction of a liquid incinerator, a novel method for fast chemical measurements and feedback control"
D353, تصميم وتقييم بروتوكول اتصالات p2p موثوق لشبكات ieee 802.11b ,design and evaluation of a reliable p2p communication protocol for ieee 802.11b networks
D354, تصميم وتنفيذ حلقات تتبع شفرة cdma الرقمية بالكامل ,design and implementation of all-digital cdma code tracking loops
D355, تصميم وتحليل شبكة أجهزة الصراف الآلي عالية الأداء التي تتحمل الأخطاء ,design and analysis of a high-performance fault-tolerant atm network
D356, تصميم ونمذجة مضاعفات الوحدات عالية السرعة لأنظمة التشفير ,design and modeling of high speed modulo multipliers for cryptosystems
D357, تصميم وتنفيذ فتحة مقسم الطاقة microstrip مكدسة ل هوائيات مجموعة ,design and implementation of aperture stacked microstrip power divider for array antennas
D358," تصميم وتنفيذ نظام رسومات ثلاثية الأبعاد ، نهج نمذجة هرمية تفاعلية ",design & implementation of a 3d graphics system an interactive hierarchical modeling approach
D359, تصميم وتنفيذ أقصى وحدة تحكم لتتبع نقاط الطاقة للأنظمة الضوئية ,design and implementation of maximum power point tracking controller for photovoltaic systems
D360, تصميم وتشغيل جهاز رصد قاذورات لدراسة التلوث في أنبوب ملتوي ,design and operate a fouling monitoring device to study fouling at twisted tube
D361, التصميم الأمثل لأنابيب الكربون متناهية الصغر باستخدام مفاعل يعمل بترسيب ,design & optimization of cnt’s prod. in cvd reactor
D362, تصميم وتقييم أداء مخططات تخصيص الموارد لأنظمة mimo-ofdma مع قيود   الإنصاف ,design and performance evaluation of resource allocation schemes for mimo-ofdma systems with fairness constraint
D363, تصميم ومحاكاة نموذج التيار لمكبرات الطي وتطبيقاته في التحولات من تماثلي الى   رقمي ,design and simulation of a current-mode folding amplifier and its application in analog-to-digital converter
D364, تصميم وتقييم أداء أبراج التبريد التبخيري ,design and performance evaluation of evaporative cooling towers
D365, اعتبار التصميم لشبكة الاستشعار اللاسلكية للأتمتة الصناعية ,design consideration for wireless sensor network for industrial automation
D366, تصميم واختبار سخان الميكروويف ,design and test of a microwave heater
D367, تصميم واجهة مستخدم رسومية لتعزيز نظام الرؤية الثنائية في أنظمة الاذرع الالية   العاملة عن بعد ,d esign o f a g raphical u ser interface to a ugm ent a t elerobotic stereo-v ision system
D368, تصميم نظام استخلاص الزيت المعزز بالسطح القلوي لخزان من الحجر الجيري   العربي السعودي ,design of an a lkaline/surfactant/polym er enhanced oil recovery scheme for a saudi arabian limestone reservoir
D369, تصميم هوائي LTE للاتصالات المتنقلة ,design of an lte antenna for mobile communications
D370, تصميم جهاز إلغاء الصدى للقاعات الصوتية ,design of an echo canceller for acoustic halls
D371, مقاييس اقتران مستوى التصميم لنماذج uml ,design level coupling metrics for uml models
D372, تصميم وتقييم أداء أنظمة التبريد باستخدام النماذج الديناميكية الحرارية ,design and performance evaluation of refrigeration systems using thermodynamic models
D373, تصميم لاستبدال النظم في المباني ,design for systems replacement in buildings
D374, تصميم شبكة تغذية بالميكروويف ذات نطاق عريض قابلة للبرمجة ,design of a programmable wideband microwave feed network
D375, تصميم مرشح النطاق المحسن لنقل البيانات محدود الطاقة ,design of band limited energy optimized data transmission filter
D376, تصميم دوائر الحوسبة التناظرية في الوضع الحالي CMOS ,design of cmos current-mode analog computational circuits
D377, تصميم القالب المركب لسحب الأسلاك ,design of composite die for wire drawing
D378, تصميم نيت لاستجابة النبضة (التنوب) لترات استقراء مجال الموجة ,the design of finite impulse response (fir) wave field extrapolation
